comentario,usuario,fecha,likes,video_id
me parece o esta temblando,@alexanderalvarado9138,2025-05-11T00:06:04Z,0,lfG8PiImmsM
"Sus troIes pagados dicen que ""no existe"" este penoso video.  ¡A LA REJA!",@Viva_la_constitucion-1993,2025-05-10T23:47:38Z,0,lfG8PiImmsM
Pta fuimos el gilaso que vuelve con la ex  en su momento 2 campesinos atorrantes cagaron el pais,@darkergreenstudios8277,2025-05-05T10:30:19Z,0,lfG8PiImmsM
Olvidarenos esto como el 2020 de alianza risa,@PieroAndre-l1o,2025-04-30T13:39:32Z,0,lfG8PiImmsM
EL MISMO DISCURSO DEL POBRESITO CASTIBURRO CASTIBURRO ESTAS EN EL LUGAR AHORA POR TUS PROPIOS ACTOS Y ACCIONES SOLITO TE PUSISTE LA SOGA AL CUELLO Y AQUIEN CULPAS AHORA,@carlosvargas4251,2025-04-26T02:07:10Z,0,lfG8PiImmsM
"No todo el mensaje era malo 
Si desde ese día hubiera habido toque de queda a nivel nacional no estaríamos así como estamos hoy  2025 
Wbns",@lullycalderon6437,2025-04-23T14:50:08Z,1,lfG8PiImmsM
Todas las pruebas de acuerdo a ley exijo minimo 30. Años de cana,@Rocapa-f6x,2025-04-20T00:57:27Z,0,lfG8PiImmsM
Este señor es digno representa de todos sus seguidores 🫏s de 💩,@samcj2729,2025-04-18T17:22:36Z,1,lfG8PiImmsM
LA PEOR BURRADA DE PEDRO CASTILLO,@ALX_N0R35,2025-04-17T02:47:18Z,2,lfG8PiImmsM
😅😅😅😅 Si me acuerdo...!!,@josealcantara2571,2025-04-16T14:33:39Z,0,lfG8PiImmsM
DESPUES DICE QUE ESTABA SEDADO😂😂😂😂😂,@tania.m9172,2025-04-14T22:43:15Z,0,lfG8PiImmsM
este pobre hombre habrá pensado que dar un golpe de estado es ponerse frente a la cámara y decir su discurso. Pobre infeliz. Ojalá nunca salga de la cárcel.,@gonzaloarturorosadioaguirr2672,2025-04-13T18:23:01Z,1,lfG8PiImmsM
Cadena perpetua,@joseherreracampana9831,2025-04-12T02:36:38Z,0,lfG8PiImmsM
Este no sabe ni lo que lee,@Castle2304,2025-04-10T04:17:47Z,0,lfG8PiImmsM
Animal ,@Castle2304,2025-04-10T04:17:23Z,0,lfG8PiImmsM
Salvaje,@Castle2304,2025-04-10T04:17:11Z,0,lfG8PiImmsM
Bestia,@Castle2304,2025-04-10T04:16:59Z,0,lfG8PiImmsM
Con todo respeto a todos no soy ni era un simpatizante de Castillo pero tenía q decirle las cosas en su cara al congreso,@juanlivisichavez6842,2025-04-08T18:38:16Z,2,lfG8PiImmsM
Asta ora no puedo crer q esa cosa fue presidente es como meternos a la boca del lobo comunistas tucos,@paulmarcelcarrascochavez779,2025-04-07T21:05:35Z,1,lfG8PiImmsM
tantas cosas buenas para el pais que se mencionaron y nada su pudo hacer gracias a las ratas del congreso y sus jefes.,@yordanzarateluza4945,2025-04-07T19:47:39Z,1,lfG8PiImmsM
Y él lo escribio solito...vaya vaya. El champiñon esta perdido y queria otro ministerio para meter a sus rojos amigos.,@fran258,2025-04-02T23:29:08Z,0,lfG8PiImmsM
"Lo tenía. Premeditadamente...es con alegocia y ventaja.....un cobarde mayusculo..... porque todo lo que hace es.  VÍCTIMIZARSE para justificar 
su. Robo.....democracia. Bo tirne ni idea.... dictadura. Congresal???  Es bien conchudo este parásito...",@alfonsoyapias8465,2025-03-31T19:28:44Z,0,lfG8PiImmsM
JAJAJAJA,@robertomunoz2919,2025-03-30T19:20:16Z,0,lfG8PiImmsM
Cuando algunos Peruanos elegían con el hígado en la mano eran capaces de traicionar asu patria  poniendo de presidente a un Analfabeto que decía ser profesor...no mas asnos en un Perú Inteligente.,@jorias6119,2025-03-29T21:46:46Z,3,lfG8PiImmsM
LOS ROJOS  COMO PEDRO CASTILLO Y LOS HNOS CERRON   NUNCA BUNCA MAS.,@filomonchavez1177,2025-03-29T14:18:39Z,1,lfG8PiImmsM
Y ahora espera sus 40 año de cana 🤣🤣🤣🤣,@lendyquevedoreyes,2025-03-28T02:34:47Z,3,lfG8PiImmsM
Se disfrazo de maduro trmendo ladron,@carlosantoniocampanabarraz7091,2025-03-27T21:58:57Z,3,lfG8PiImmsM
😂😂buuurrrro chotano,@yumitogo,2025-03-27T18:50:10Z,2,lfG8PiImmsM
INTELIGENCIA ARTIFICIAL,@LASVILLASSP,2025-03-25T21:17:59Z,0,lfG8PiImmsM
Quienes deberían de estar en el banquillo de acusados por los jueces del Perú serían los parlamentarios pero los jueces están al servicio de los gobiernos extranjeros y pasan por encima del voto popular del Perúvaya que Democracia.,@ricardolovely8389,2025-03-25T05:30:10Z,0,lfG8PiImmsM
Vivan los 34 años que te van a dar por imbesil!,@EduardoTorres-w7x,2025-03-25T04:25:16Z,2,lfG8PiImmsM
El hombre está amenazado por eso tiembla.,@YannethYufra,2025-03-25T02:15:41Z,1,lfG8PiImmsM
IGNOTO PROSOR SINDICALISTA GREMIAL MAGISTERIAL hasta la última.,@luisrios8701,2025-03-25T00:31:42Z,0,lfG8PiImmsM
Y dice que no hay pruebas de su fallido  golpe Caníbal Torres porqué está suelto? el  azuzador que decia: correrán ríos de sangre,@pascualaraujoparedes4387,2025-03-24T13:25:59Z,2,lfG8PiImmsM
Me imagino que no sabe bien lo que lee,@HansFurchtlos78,2025-03-24T01:49:41Z,1,lfG8PiImmsM
Tiene la cara de un delincuente,@miguelantonioizquierdoalva6050,2025-03-23T13:57:33Z,2,lfG8PiImmsM
Pasando el tiempo sus Congresistas les fallaron de eso hablava el discurso  ahora aguantense las extorciones Mortales  y delincuencia callejera en Lima  y saqueo de toneladas de Oro de las empresas extrangeras  sobre todo de Estados Unidos  para Brutos no hay quien los Gane  les gusts el asote del extrangero el descuartisamiento  y de castigo les toco tambien una tarada de Presidenta gh,@MarlonHisbes,2025-03-23T06:18:53Z,0,lfG8PiImmsM
La verdad es que el congreso no lo dejaba trabajary a otros gobiernos anterior. Pasó lo mismo con PPK Vizcarra y con Castillo y hay q ser un peruano con cerebro de pez para no darse cuenta. El congreso roto el equilibrio de poder,@italotangoa5401,2025-03-22T23:19:22Z,0,lfG8PiImmsM
😂 la betsy ledio agua de calzon 😂😂 para emborracharlo de poder te metiste la soga al cuello betsy te dio la soga y el caníbal de ahorcó 😂😂😂😂ajajajajajajaj,@gilmarsuclupe5376,2025-03-22T17:46:30Z,1,lfG8PiImmsM
No sabe ni leer este troglodita!!,@ahmedloochkart2633,2025-03-21T11:56:56Z,2,lfG8PiImmsM
Me recomendó hoy Youtube pq sera,@tonyblazedeconoeste.444,2025-03-21T01:24:54Z,1,lfG8PiImmsM
Gracias burro y Gracias Dios,@brunozapata5902,2025-03-20T23:47:31Z,2,lfG8PiImmsM
Esté sr no es dictador viva Pedro castillo presidente de Perú,@JulioCesarFernandez-pg1jd,2025-03-20T20:05:52Z,0,lfG8PiImmsM
Por dentro decía la cge voy a terminar de cla,@CruverAlejandroMelgarejo,2025-03-18T22:41:13Z,1,lfG8PiImmsM
5:30 que tiene que ver la guerra d Rusia y Ucrania animal,@stevbc,2025-03-18T20:50:19Z,2,lfG8PiImmsM
Sabía muy bien que estaba cometiendo golpe de Estado y se k aba de miedo. Prueba de ello es que salió corriendo de Palacio con su tenebrosa familia mafiosa en dirección a la Embajada de México en plan de fuga...,@Ruben-y7y,2025-03-17T01:10:29Z,1,lfG8PiImmsM
Les queda alguna duda de que no fue golpe de estado?,@manuelsantosponcepolanco5796,2025-03-16T16:52:05Z,2,lfG8PiImmsM
6:32 AQUI EMPIEZA el Anuncio del GOLPE,@P.E.R.U.,2025-03-16T04:14:32Z,2,lfG8PiImmsM
1:19 PERO TU NO ERES un CAMPESINO!!!!!!! Deja de Mentir y Víctimizarte!!!!! Tienes una Profesión eres MAESTRO no eres un Campesino asi que deja de Intentar Dar Lastima !!!,@P.E.R.U.,2025-03-16T04:12:14Z,2,lfG8PiImmsM
Si comias rico dormías bien.  Pero te juntas te con puro ratero,@VictorAcevedo-c3h,2025-03-15T16:50:05Z,1,lfG8PiImmsM
AHORA DILO SIN LLORAR,@boristorbiscoalarcon7592,2025-03-15T08:11:53Z,1,lfG8PiImmsM
Tiembla tuco tiembla 5:35,@elconservador5455,2025-03-14T19:20:01Z,5,lfG8PiImmsM
Estaba fugándose el tío castillo🤣🤣🤣,@GilbertLaura,2025-03-14T18:23:39Z,1,lfG8PiImmsM
A quien le da ganas de vomitar al ver y escuchar a este tipejo?,@martinherrera4241,2025-03-14T02:09:24Z,4,lfG8PiImmsM
Ni Los ronderos le hicieron caso,@martinherrera4241,2025-03-14T02:07:28Z,1,lfG8PiImmsM
Nunca olviden que este tipejo quiso hacer del Peru otra Venezuela,@martinherrera4241,2025-03-14T02:05:10Z,3,lfG8PiImmsM
Nunca olviden que este tipejo quiso hacer del Peru otra Venezuela,@martinherrera4241,2025-03-14T01:59:33Z,17,lfG8PiImmsM
Gracias Pedrito ahora te vas a CANADÁ FOREVER,@Franco-u1r,2025-03-12T20:12:41Z,3,lfG8PiImmsM
"*Cuando dice que ""ya está comunicando a la OEA"" y hace referencia al artículo 27 donde se comunica la suspensión de derechos humanos por motivos como este ya está diciendo que está ejecutando en ese momento el golpe de Estado y no es ninguna proclama Castillo ya estaba comunicándose con organismos internacionales para justificar la suspensión de derechos humanos este asno se merece la pena máxima por tamaño atrevimiento.*",@perry521,2025-03-12T14:19:23Z,3,lfG8PiImmsM
"*Estamos mil veces mejor sin ti ""burro"".*",@perry521,2025-03-12T14:01:37Z,1,lfG8PiImmsM
Y eso fue tu caída por qué?....,@soundwave9629,2025-03-12T01:51:29Z,0,lfG8PiImmsM
Jajajaja no se vomo llamarlo sin insultarlo es un hombre patético infeliz entonces que fue lo que escuchamos di es un golpe solo ni en eso se dió cuenta el pueblo apoya cuando es un buen presidente quien lo iba apoyar ni antauro quizo jajajaja,@Casilda-wm9gy,2025-03-11T22:42:37Z,1,lfG8PiImmsM
Si todos los que comentaron mal estarian ahi tambien serian los burros como a si lo mencionan en los comentarios,@Bautistas979,2025-03-11T18:25:29Z,0,lfG8PiImmsM
Sólito caíste en tu propia trampa.. Igual que juego de tronos te traicionaron tus abanderados,@JoseTorres-jv7dy,2025-03-11T17:21:13Z,1,lfG8PiImmsM
"Un ""presidente"" leyendo algo que ni el mismo entiende"" jajajaja",@robertoparraga8710,2025-03-07T17:38:08Z,8,lfG8PiImmsM
Yo pienso que fue valiente pese a que no tenia apoyo de las fuerzas armadas que quisas ya estaban compradas por.los opositores el congreso queria darle vacancia 1 2  varias veces porque??? Ahora esta en la carcel segkn el plan condor del siglo 20 matarlo judicialmente,@JuanColque-j5n,2025-03-07T13:04:57Z,0,lfG8PiImmsM
Estaba nervioso xq no sabia leer,@aldoachong4068,2025-03-06T17:12:48Z,1,lfG8PiImmsM
No olvide ningún peruano de este tipo de gente que quiso oprimir a un pueblo quitabto la libre expresión  y el cambio de constitución  a su antojo. Su victimización es su estilo para que el pueblo no informado hace  lo que el comunista capturaba los sectores más vulnerables de la población en Perú,@leonardaturpoquispe5506,2025-03-06T16:36:34Z,1,lfG8PiImmsM
Lamentable lo que este señor menciona fue un títere de las personas que todos ya conocen.,@jhongonzales5065,2025-03-05T14:56:46Z,1,lfG8PiImmsM
Sonaja de BB,@libra81mm42,2025-02-13T06:20:32Z,0,lfG8PiImmsM
El presidente más animal que tuvo el pueblo Peruano y sin ofender a los pobres animalitos una vergüenza 😂😂😂,@Animeshom,2025-02-12T16:59:50Z,1,lfG8PiImmsM
"ESTE ES OTRO TITERE DE LAS GRANDES Y MONSTRUOSA CASTAS SOCIALES QUE MANEJAN EL MUNDO..
POR ESO LEE LO QUE LE ENVIARON A LEER PARA GENTE Q NI SIQUIERA SE DA CUENTA ... Q SOLO SOLO SON  GOBERNADO POR PERSONAS QUE SOLO DICEN LO Q SE LES MANDA ...Y SIN SALIR DE LOS MARCOS...
UD PIENZAN Q ESTE TIPO MAS IDENTIFICADO CON LOS DE MENTE POBRE...E INCAPAZ DE SER UN PROFESIONAL QUE  PUEDE GOBERNAR UN PAIS QUE TIENE TANTAS RESPONSABILIDADES  ???
LO QUE YO VEO ES SOLO UN TIPO IGNORANTE PUESTO POR LA ELITE...   PARA Q CUMPLA SUS FUNCIONES...   DE DOMINIO...  POR UNOS MILES DE DOLARES...  MIENTRAS LA ELITE .. SAQUEA PERU  Y OTROS PAISES...",@adriangutierrez7271,2025-02-10T12:46:12Z,0,lfG8PiImmsM
Ver. A. Este. Personal. Ya.  Da. Asco. Ya. Pues. Preso. Esta. Y. Punto,@ReneRuttiPerez,2025-02-03T23:36:19Z,1,lfG8PiImmsM
YA PASARON 2 AÑOS DE ESTE MOMENTO Y PARTE DE LO QUE DIJO ES SU DISCURSO DE LOS CONGRESISTAS ES CIERTO XD,@YersonDominguez545,2025-01-25T22:55:05Z,0,lfG8PiImmsM
Una oveja bruta que se creyo un lobo.,@anthonybryanlopezespinoza84,2025-01-25T18:43:55Z,2,lfG8PiImmsM
Lo votaron por incompetente. 😂😂😂,@AlfaOmega56153,2025-01-21T20:19:29Z,2,lfG8PiImmsM
Semejante Jeropa castillo como le tiembla la mano.,@kunnitoBikers,2025-01-01T02:16:26Z,2,lfG8PiImmsM
El fin del pollo,@gianfrancohuisapichihua8044,2024-12-31T13:00:19Z,2,lfG8PiImmsM
Eso te pasa por ser un pobre y triste iletrado que ni robar sabías para colmo sindicalista y terruco. Saludos a Vladi,@jeanchaconbarboza7528,2024-12-30T22:10:35Z,2,lfG8PiImmsM
Cagandose de miedo hablaque valiente,@Sillyboi-h6r,2024-12-19T23:40:55Z,2,lfG8PiImmsM
TODO YA ESTABA PREPARADO PARA SU SECUESTRO Y ESTO LA PRENSA VENDIDA LO SABE INCLUYENDO UDS TVPERU MANIPULADORES SIGUEN MINTIENDOLE A LA POBLACION MAQUILLANDO INFORMACION,@vito2423,2024-12-10T16:25:44Z,0,lfG8PiImmsM
Ese mamarracho de presidente  tuvo el Perú..por culpa de una mayoría ignorante y resentida quien lo eligió... pero como es tan ignorante inepto y ladrón...se hizo el haraquiri gracias a dios...y se salvó el Perú de tan nefasto sujeto..,@fernandoelizalde3462,2024-12-09T21:30:13Z,1,lfG8PiImmsM
Callo el burro,@LIBERTADVIDAPROPIEDADYFAMILIA,2024-12-09T21:18:37Z,1,lfG8PiImmsM
Metió como siempre el racismo tremendo acomplejado,@JoséArbe-e5p,2024-11-25T18:52:00Z,1,lfG8PiImmsM
Hasta esto lo hizo mal este inepto…..,@mdhcz,2024-11-23T22:20:10Z,2,lfG8PiImmsM
Regresaras pronto presidente,@juanjosecerdaclemente7662,2024-11-11T21:00:32Z,2,lfG8PiImmsM
PORQUÉ TIENE QUE ESTAR LEENDO TANTO!!! NO TIENE NADA QUE DECIR SIN ESTAR LEENDO?😅😮😊,@JoseSevilla-m7w,2024-11-07T18:02:55Z,1,lfG8PiImmsM
"Era claramente lo que dijo que iba a pasar una  dictadura kongresal se cumplió lo que advertía  

Aunque vuestra capacidad no era muy grande el entorno de gente con la que se había rodeado eran nocivas... Si tenía posibilidad de haber cerrado esa cloaca  legalmente  castillo era una piedra en el zapato ante ese kongreso
crim1nal y fascista...

Ya que si se hubiera arrodillado a esas mafias estaría bien protegido como lo hacen con d1na.",@dereksoul1491,2024-10-19T02:36:41Z,0,lfG8PiImmsM
El heroe de los mamertos hahahaha,@davidmanzanares2313,2024-10-17T17:05:31Z,1,lfG8PiImmsM
EL MENSAJE DEL VALIENTE  PRESIDENTE PEDRO CASTILLO DEBE CUMPLIRSE PARA ELIMINAR A TODAS LAS MAFIAS QUE GOBIERNAN EL PAIS.,@osofacton,2024-10-09T16:04:37Z,0,lfG8PiImmsM
K cabeza cave k un Maestro no sepa leer sera un ignorante era por el momento kvestaba ocuriendo con sus manos temblorosas y seguro k presionado,@soniacrespo6718,2024-10-08T23:41:35Z,0,lfG8PiImmsM
Por esa lectura k no le convenia ni al congreso ni al poder judicial lo an secuestrado la mafia fugimorista totalorizada porq quieren todo para ellos nada para el pueblo y k no avancen los pobres Muy bien infundada esa lectura Presidente tenias toda la razon pero te traicionaron y te dieron golpe de. estado primero k basuras son,@soniacrespo6718,2024-10-08T23:35:39Z,0,lfG8PiImmsM
Estaba bien ese Golpe de Estado.,@juancho-f8r,2024-10-05T04:07:11Z,0,lfG8PiImmsM
como arruinar tu vida en menos de 10 minutos:,@Barangel67,2024-10-01T01:34:14Z,4,lfG8PiImmsM
Se suicidó políticamente,@elrockero80s,2024-09-16T05:19:04Z,0,lfG8PiImmsM
Por el mismo camino va el guerrillero Petro en Colombia,@animadelinframundo,2024-09-01T15:18:41Z,3,lfG8PiImmsM
En el Perú vota la ignorancia permanente avalada por los gobiernos  a los que le conviene mantenerlos sin educación para así seguir engañando los fácilmente. Cuando despertará el pueblo.,@martinraffo1046,2024-09-01T06:26:32Z,2,lfG8PiImmsM
Si más no recuerdo y por favor dejenme saber si me equivoco. Fujimori lo hizo desde Japon cuando hiso está cagada.,@vivianasanper,2024-09-01T03:12:29Z,0,lfG8PiImmsM
era para que designes cabezas en el ala militar y policial no que te mandes así de frente ese fue tu error,@jolura,2024-08-05T10:36:40Z,0,lfG8PiImmsM
Jajaja serr🤪🤪no,@DenyGutierrez-n5i,2024-08-04T20:03:38Z,0,lfG8PiImmsM
Asta hora no lo sentencian dina esta blondandolo,@hipotumundo1822,2024-08-01T23:34:25Z,0,lfG8PiImmsM
AHI ESTA TU GOLPE. EL INTERNET NO OLVIDA RE DESCARGADO MIN 06:52,@3mb360,2024-08-01T01:31:58Z,3,lfG8PiImmsM
Eso debía cumplirse.,@juancho-f8r,2024-07-31T04:48:45Z,0,lfG8PiImmsM
te extraño castillo,@heygusim,2024-07-18T01:06:09Z,1,lfG8PiImmsM
Buena proclama ¡ Viva el Perú!,@CelsoAgustinPerezDios,2024-06-26T05:10:44Z,0,lfG8PiImmsM
Eso es una denuncia pública y un deseo de cambio. No es un mensaje a la nación porque no ha sido aprobado por el consejo de ministros tal como lo manda la constitución.,@CelsoAgustinPerezDios,2024-06-26T05:06:55Z,0,lfG8PiImmsM
SEÑORES MIREN A BOLIVIA ESE ERA EL EJEMPLO A SEGUIE E.ESTE SEÑOR.,@liderhablolaverdad1665,2024-06-11T00:53:44Z,2,lfG8PiImmsM
ESTE BURRO MEJOR SALIA CON SU METRALLETRA Y MATRACA JJJAJAJJA,@PGWORK,2024-06-07T21:04:18Z,1,lfG8PiImmsM
Después de un año no era la forma. Sin embargo tuvo razón al final son el congreso y los partidos políticos de siempre los golpistas,@DJELMERFOX,2024-05-31T08:54:03Z,1,lfG8PiImmsM
Jaja q bruto como tiembla,@AdrianoNaranjo-ob6br,2024-05-09T21:53:41Z,0,lfG8PiImmsM
Es una pena como el Peru tiene este tipo de gobernantes y sucesos la falta de educacion y valores hacen tambien que la poblacion no estee exenta de responsabilidad de todo lo que ocurre ahora esta asumiendo las consecuencias de sus actos ya le llegara la hora a la usurpadora dos y todos los conspiradores que hacen del pais una cloaca.,@JavierEspinozaEncarnación,2024-04-12T08:30:31Z,0,lfG8PiImmsM
Después de esto los comunistas SENDERISTAS dijeron q le estaban apuntando con una pistola que lo habían dopado q Keiko le dijo q lea ese mensaje toda una estupidez q inventaron los COMUNISTAS MARXISTA LENNISTA SENDERISTA para tratar de tapar el golpe de estado,@WilliamSilva-jt3kr,2024-03-30T23:09:24Z,2,lfG8PiImmsM
Tdqd animal rojete,@jamesmallqui1771,2024-03-19T01:37:15Z,0,lfG8PiImmsM
EL TIEMPO TE DIO LA RAZON AR PRESIDENTE  NO ESTABAS LUCHANDO CON PARTIDOS POLITICOS Q QUIEREN CONSTRUIR UN PAIS SON MAFIAS Q DEZTROZAN EL PAIS Q PENA POR LA GENTE Q TIENE CONOCIMIENTO  Y UTILICE SU CONOCIMIETO PARA DIZTORCIONAR O CONFUNDIR MIS PESPETOS POR NO VENDERSE COMO OTROS S Q SI SE VENDEN PERO SI DE ESO SE TRATA DESTRUIR  FORMAR CIUDADANS SIN  VALORES DONDE EL PAPEL TIENE MAS VALOR Q KA VIDA KKK,@RoneldavidMaquinllashag,2024-03-02T14:43:23Z,2,lfG8PiImmsM
El golpe de estado lo cometió el congreso prohibiendo el REFERENDUM LA CUAL ES EL DERECHO DE TODOS LOS PERUANOS.,@rubenflores4344,2024-02-06T01:10:25Z,0,lfG8PiImmsM
El golpe de estado lo cometió el congreso prohibiendo el REFERENDUM LA CUAL ES EL DERECHO DE TODOS LOS PERUANOS.,@rubenflores4344,2024-02-06T01:10:19Z,0,lfG8PiImmsM
El golpe de estado lo cometió el congreso prohibiendo el REFERENDUM LA CUAL ES EL DERECHO DE TODOS LOS PERUANOS.,@rubenflores4344,2024-02-06T01:10:03Z,0,lfG8PiImmsM
Ni leer sabe está bestia por DIOS😖😖,@aldoComercial-xl7gt,2024-02-05T20:05:01Z,1,lfG8PiImmsM
En este mensaje lee los chistes de condorito el tiro le salio por la culata EL VIVO,@poncianosantamariamallqui4014,2024-01-25T16:34:36Z,2,lfG8PiImmsM
El inicio del fin de Pedro Castillo 😮,@gianfrancohuisapichihua8044,2024-01-25T01:00:09Z,1,lfG8PiImmsM
"Minuto 6 con 50
Empieza la conga",@mirkojimenezruiz5744,2024-01-19T18:59:48Z,0,lfG8PiImmsM
Como una persona q no sabe mucho de leyes lo hayan dejado pisar el palito para meterlo a la carcel quien dwberia estar preso es anibal torres y betsy chavez,@lanochedelasestrellas9211,2024-01-15T18:34:51Z,0,lfG8PiImmsM
Como temblaba pobre.,@SephirotKnight,2024-01-05T19:13:21Z,0,lfG8PiImmsM
Caníbal y la Betsy le hicieron meter la pata al pollo 😅,@gianfrancohuisapichihua8044,2024-01-02T01:11:21Z,1,lfG8PiImmsM
😂😂😂😂,@alejandrog5840,2023-12-25T22:17:27Z,0,lfG8PiImmsM
En este mensaje ya adelanta del colchon bolzas plasticas baldes a mexico con millones,@poncianosantamariamallqui4014,2023-12-24T17:16:55Z,0,lfG8PiImmsM
Mal jugado pipipipi,@mickyvilla8829,2023-12-24T14:39:00Z,0,lfG8PiImmsM
JAJAJAJAJAJAJJAJA HASTA PARA ESO ES BRUTO LA BESTIA ESTA 😂 DA PENA,@christianesteban9551,2023-12-21T21:38:28Z,1,lfG8PiImmsM
Bravo mi presidente castillo 🇵🇪🇵🇪🇵🇪🇵🇪,@saliendoderutina9279,2023-12-09T19:03:22Z,1,lfG8PiImmsM
"Cuando termina de leer se escucha al fondo ""Ay no"".",@JAMESBOND-se5iw,2023-12-08T05:31:41Z,0,lfG8PiImmsM
Solo se vaco que gobierno más inepto.,@Alike2022,2023-12-08T03:05:23Z,1,lfG8PiImmsM
Hoy se cumple un año de esta joya jajaja que se pudra en la cárcel ese delincuente,@lDarthTrader,2023-12-07T20:44:32Z,2,lfG8PiImmsM
XDDDDDDDDDDDDDDDDDDDDDDDDDDDDDDDDDDD 👉,@peterdanielxd2166,2023-12-07T18:33:46Z,0,lfG8PiImmsM
TVperu no representa al pueblo estan del lado de los grande abusibos.....,@josimarchirio,2023-11-10T20:09:31Z,0,lfG8PiImmsM
Alguien sabe si término el cuento del pollo?,@johndream6126,2023-11-09T20:45:21Z,2,lfG8PiImmsM
Claramente le tendieron una trampa,@HowardSalas,2023-11-02T03:18:36Z,1,lfG8PiImmsM
VOTEMOS A LA GENTE DEL CONGRESO ME UNO ALA TURBA COMPARE,@MostWantedHez,2023-11-01T18:23:08Z,0,lfG8PiImmsM
delincuente,@florencioobregon7624,2023-10-23T14:06:11Z,2,lfG8PiImmsM
3 doritos despues....detenido,@huguisvas3648,2023-10-20T16:56:09Z,1,lfG8PiImmsM
Si la cagado al país peruana que siga en.carsel,@AlfredoAguilar-lp5md,2023-10-19T15:51:26Z,2,lfG8PiImmsM
Mi pedrito era tiempo  asi seabla  cholo era tiempo mi señor,@MaxBustamante-qz7dl,2023-10-04T08:38:30Z,0,lfG8PiImmsM
Asi seabla pedrito,@MaxBustamante-qz7dl,2023-10-04T08:31:20Z,0,lfG8PiImmsM
Que bueno que este sujeto nefasto como presidente este preso aya debe de estará el su familia y amigos quienes se llenaron los bolsillos del dinero del Perú 🇵🇪,@jose51790,2023-10-02T23:21:16Z,0,lfG8PiImmsM
FARSANTE,@cesarterrones8286,2023-09-30T23:05:22Z,0,lfG8PiImmsM
El más ladrón,@carlossandoval8103,2023-09-29T11:17:18Z,0,lfG8PiImmsM
se nota el nerviosismo de ese primate a leguas se veía que no tenia idea de lo que iba a ocurrir después estoy seguro que quien le aconsejo leer eso solo hizo pensando que porque a Vizcarra le funciono también al mono con sombrero le iba a funcionar pero se olvidaron de algo muy importante Vizcarra tenia el apoyo de casi todo el pais cuando dio su golpe de estado y técnicamente todo lima salió a ver que se cierre ese congreso mientras que el burro con sombrero no tenia respaldo de nadie los que lo apoyaban ya eran una minoría y mas del 70%  del pais estaba en su contra por diversas razones por primera vez se actuó como se debía ante un burdo intento de dictadura ironías del destino el burro con sombrero acabo junto a su ahora vecino Fujimori será una historia digna de contar a los nietos.,@KingMasterDark,2023-09-20T14:51:27Z,1,lfG8PiImmsM
Le faltó Convicción Política y un buen Instructor Militar y Asesor Militar y con eso Cerraba ese Congreso delincuencial,@eduardocordovarios3161,2023-09-05T03:52:43Z,0,lfG8PiImmsM
Taba drogado al votar por el😢,@alessandroyupanqui9571,2023-09-01T21:15:12Z,10,lfG8PiImmsM
Con ese mensaje el solito acabo con su gobierno,@ignaciocuadradob.238,2023-08-16T17:20:18Z,1,lfG8PiImmsM
Le temblaba la mano JAJAJJA XD,@flex_sway4219,2023-08-07T09:24:07Z,1,lfG8PiImmsM
Pipiipiipip😢,@chenko11,2023-08-01T19:42:40Z,0,lfG8PiImmsM
Ya llegará el momento en que nuestro país se deshaga de todos los lastres que lo han mantenido empobrecido y desindustrializado. Gracias Presidente Castillo por intentarlo.,@AWorldOfLanguages,2023-07-28T05:15:47Z,0,lfG8PiImmsM
Viva el poeblo PERUANO livre e independente: Liberdade imediata para o presidente PEDRO CASTILLO 🇨🇭🇵🇹🇵🇪✌️✌️,@luisfilipe316,2023-07-27T20:08:56Z,0,lfG8PiImmsM
Jamás sabremos si el pollo estaba vivo o estaba muerto. 😢,@franciscobleheri5139,2023-07-25T04:56:36Z,1,lfG8PiImmsM
DIOS GRACIAS!!! NOS LIBRAMOS POR UN PELITO DEL COMUNISMO EMPOBRECEDOR.. 🙏🙏🙏🇵🇪🇵🇪,@gloriarudyghiglinorosales8835,2023-07-21T21:42:11Z,0,lfG8PiImmsM
jajajajajjajajajajajjajaja,@rikycisneros4607,2023-07-20T22:01:34Z,0,lfG8PiImmsM
Es un hecho que las pruebas son ya contundentes  Castillo Nunca mas en el Gobierno del Perú.,@felixloza776,2023-07-18T03:56:14Z,1,lfG8PiImmsM
Solo se vacooo que  bueno por bruto en hora buena,@clarisapintomendoza6583,2023-07-13T00:31:30Z,1,lfG8PiImmsM
El unico presidente que lucho contra el clasismo y la oligarquía LIMEÑA POR LOS APROFUJIMORISTAS que tienen dominado y saqueado...a las tias de los conos y las pitucas de san borjamolina y surco...,@IndustriasBriandPerú,2023-07-05T20:15:10Z,0,lfG8PiImmsM
Agua racimada prosor prosor,@marce1555,2023-06-25T19:49:19Z,0,lfG8PiImmsM
Este es el Presidente Comunismo rumbo al hambre y escases de trabajo este tipo dePersonajes debe ser castigado cadena perpetua yquitarle todo lo que a robado.,@martinquerhuayo9213,2023-06-24T22:01:33Z,3,lfG8PiImmsM
Lo hicieron leer está claro.,@aguatv9046,2023-06-24T03:16:52Z,0,lfG8PiImmsM
Estoy totalmente de acuerdo con castillo yo hubiese hecho lo mismo csm.,@williamsoberonfuentes2636,2023-06-24T01:22:22Z,0,lfG8PiImmsM
Cuando ando estresado siempre es bueno ver un poco de especial del humor en Palacio de gobierno... Pobre y triste final de este burro. 🤣,@javiermark123,2023-06-21T19:18:37Z,8,lfG8PiImmsM
El Fujimori de Chota.,@luisfernandovelasquezcapch790,2023-06-08T02:19:31Z,0,lfG8PiImmsM
Disolver disolver... Se copió sin éxito la frase de Alberto Fujimori.,@luisfernandovelasquezcapch790,2023-06-08T02:17:13Z,0,lfG8PiImmsM
Quería dejar sin empleo a miles de peruanos y extranjeros. Felizmente cayó ese marxista sin sentimientos,@luisfernandovelasquezcapch790,2023-06-08T02:01:23Z,0,lfG8PiImmsM
"La telenovela ""Luz de Luna"" predijo la caída de ese dictador frustrado.",@luisfernandovelasquezcapch790,2023-06-08T02:00:50Z,0,lfG8PiImmsM
Hace 6 meses cayó un intento de imitación de Alberto Fujimori. Sabemos cómo terminan los dictadores.,@luisfernandovelasquezcapch790,2023-06-08T01:59:29Z,0,lfG8PiImmsM
AHUEVADAZO,@omarjesus425,2023-06-08T01:18:25Z,0,lfG8PiImmsM
